{
  "version": 1,
  "route": "/docs/plugins/stripe-terminal/getting-started/",
  "source": "corpus/source/apps/docs/src/content/docs/docs/plugins/stripe-terminal/getting-started.mdx",
  "sourceSha256": "475926b587db11eed7a64570ef176b4b08065147f5a700f62fd285cf3d01665e",
  "metadata": {
    "title": "Getting Started",
    "description": "Install @capgo/capacitor-stripe-terminal and start using its Capacitor API.",
    "sidebar": {
      "order": 2
    }
  },
  "blocks": [
    {
      "type": "heading",
      "location": {
        "line": 2,
        "column": 1
      },
      "depth": 2,
      "blocks": [
        {
          "type": "text",
          "location": {
            "line": 2,
            "column": 4
          },
          "text": "Install"
        }
      ]
    },
    {
      "type": "code",
      "location": {
        "line": 4,
        "column": 1
      },
      "lang": "bash",
      "meta": null,
      "text": "bun add @capgo/capacitor-stripe-terminal\nbunx cap sync"
    },
    {
      "type": "heading",
      "location": {
        "line": 9,
        "column": 1
      },
      "depth": 2,
      "blocks": [
        {
          "type": "text",
          "location": {
            "line": 9,
            "column": 4
          },
          "text": "Import"
        }
      ]
    },
    {
      "type": "code",
      "location": {
        "line": 11,
        "column": 1
      },
      "lang": "typescript",
      "meta": null,
      "text": "import { StripeTerminal } from '@capgo/capacitor-stripe-terminal';"
    },
    {
      "type": "heading",
      "location": {
        "line": 15,
        "column": 1
      },
      "depth": 2,
      "blocks": [
        {
          "type": "text",
          "location": {
            "line": 15,
            "column": 4
          },
          "text": "Backend requirement"
        }
      ]
    },
    {
      "type": "paragraph",
      "location": {
        "line": 17,
        "column": 1
      },
      "blocks": [
        {
          "type": "text",
          "location": {
            "line": 17,
            "column": 1
          },
          "text": "Stripe Terminal requires a secure backend endpoint that creates connection tokens. Pass that URL to "
        },
        {
          "type": "inlineCode",
          "location": {
            "line": 17,
            "column": 101
          },
          "text": "initialize()"
        },
        {
          "type": "text",
          "location": {
            "line": 17,
            "column": 115
          },
          "text": "."
        }
      ]
    },
    {
      "type": "code",
      "location": {
        "line": 19,
        "column": 1
      },
      "lang": "typescript",
      "meta": null,
      "text": "await StripeTerminal.initialize({\n  tokenProviderEndpoint: 'https://api.example.com/stripe/terminal/connection-token',\n  isTest: true,\n});\n\nawait StripeTerminal.discoverReaders({ type: 'tap-to-pay' });"
    },
    {
      "type": "heading",
      "location": {
        "line": 28,
        "column": 1
      },
      "depth": 2,
      "blocks": [
        {
          "type": "text",
          "location": {
            "line": 28,
            "column": 4
          },
          "text": "Example app"
        }
      ]
    },
    {
      "type": "code",
      "location": {
        "line": 30,
        "column": 1
      },
      "lang": "bash",
      "meta": null,
      "text": "git clone https://github.com/Cap-go/capacitor-stripe-terminal.git\ncd capacitor-stripe-terminal/example-app\nbun install\nbun run start"
    },
    {
      "type": "heading",
      "location": {
        "line": 38,
        "column": 1
      },
      "depth": 2,
      "blocks": [
        {
          "type": "text",
          "location": {
            "line": 38,
            "column": 4
          },
          "text": "Source Of Truth"
        }
      ]
    },
    {
      "type": "paragraph",
      "location": {
        "line": 40,
        "column": 1
      },
      "blocks": [
        {
          "type": "text",
          "location": {
            "line": 40,
            "column": 1
          },
          "text": "This page documents the current public API from "
        },
        {
          "type": "link",
          "location": {
            "line": 40,
            "column": 49
          },
          "url": "https://github.com/Cap-go/capacitor-stripe-terminal/",
          "title": null,
          "blocks": [
            {
              "type": "text",
              "location": {
                "line": 40,
                "column": 50
              },
              "text": "Cap-go/capacitor-stripe-terminal"
            }
          ]
        },
        {
          "type": "text",
          "location": {
            "line": 40,
            "column": 137
          },
          "text": "."
        }
      ]
    }
  ]
}
