{
  "version": 1,
  "route": "/docs/plugins/stripe-identity/getting-started/",
  "source": "corpus/source/apps/docs/src/content/docs/docs/plugins/stripe-identity/getting-started.mdx",
  "sourceSha256": "9739b25cbc4a0d66fc5cbbb84e1b753d68cc88a27d30bb2166c9f98078bb8c62",
  "metadata": {
    "title": "Getting Started",
    "description": "Install @capgo/capacitor-stripe-identity and start using its Capacitor API.",
    "sidebar": {
      "order": 2
    }
  },
  "blocks": [
    {
      "type": "heading",
      "location": {
        "line": 2,
        "column": 1
      },
      "depth": 2,
      "blocks": [
        {
          "type": "text",
          "location": {
            "line": 2,
            "column": 4
          },
          "text": "Install"
        }
      ]
    },
    {
      "type": "code",
      "location": {
        "line": 4,
        "column": 1
      },
      "lang": "bash",
      "meta": null,
      "text": "bun add @capgo/capacitor-stripe-identity\nbunx cap sync"
    },
    {
      "type": "heading",
      "location": {
        "line": 9,
        "column": 1
      },
      "depth": 2,
      "blocks": [
        {
          "type": "text",
          "location": {
            "line": 9,
            "column": 4
          },
          "text": "Import"
        }
      ]
    },
    {
      "type": "code",
      "location": {
        "line": 11,
        "column": 1
      },
      "lang": "typescript",
      "meta": null,
      "text": "import { StripeIdentity } from '@capgo/capacitor-stripe-identity';"
    },
    {
      "type": "heading",
      "location": {
        "line": 15,
        "column": 1
      },
      "depth": 2,
      "blocks": [
        {
          "type": "text",
          "location": {
            "line": 15,
            "column": 4
          },
          "text": "Verification flow"
        }
      ]
    },
    {
      "type": "paragraph",
      "location": {
        "line": 17,
        "column": 1
      },
      "blocks": [
        {
          "type": "text",
          "location": {
            "line": 17,
            "column": 1
          },
          "text": "Create a VerificationSession on your backend, then pass the IDs to the plugin:"
        }
      ]
    },
    {
      "type": "code",
      "location": {
        "line": 19,
        "column": 1
      },
      "lang": "typescript",
      "meta": null,
      "text": "await StripeIdentity.initialize({ publishableKey: 'pk_test_...' });\n\nawait StripeIdentity.create({\n  verificationId: 'vs_...',\n  ephemeralKeySecret: 'ek_...',\n  clientSecret: 'vs_..._secret_...', // web only\n});\n\nawait StripeIdentity.present();"
    },
    {
      "type": "heading",
      "location": {
        "line": 31,
        "column": 1
      },
      "depth": 2,
      "blocks": [
        {
          "type": "text",
          "location": {
            "line": 31,
            "column": 4
          },
          "text": "Example app"
        }
      ]
    },
    {
      "type": "code",
      "location": {
        "line": 33,
        "column": 1
      },
      "lang": "bash",
      "meta": null,
      "text": "git clone https://github.com/Cap-go/capacitor-stripe-identity.git\ncd capacitor-stripe-identity/example-app\nbun install\nbun run start"
    },
    {
      "type": "heading",
      "location": {
        "line": 41,
        "column": 1
      },
      "depth": 2,
      "blocks": [
        {
          "type": "text",
          "location": {
            "line": 41,
            "column": 4
          },
          "text": "Source Of Truth"
        }
      ]
    },
    {
      "type": "paragraph",
      "location": {
        "line": 43,
        "column": 1
      },
      "blocks": [
        {
          "type": "text",
          "location": {
            "line": 43,
            "column": 1
          },
          "text": "This page documents the current public API from "
        },
        {
          "type": "link",
          "location": {
            "line": 43,
            "column": 49
          },
          "url": "https://github.com/Cap-go/capacitor-stripe-identity/",
          "title": null,
          "blocks": [
            {
              "type": "text",
              "location": {
                "line": 43,
                "column": 50
              },
              "text": "Cap-go/capacitor-stripe-identity"
            }
          ]
        },
        {
          "type": "text",
          "location": {
            "line": 43,
            "column": 137
          },
          "text": "."
        }
      ]
    }
  ]
}
