{
  "version": 1,
  "route": "/docs/cli/reference/star/",
  "source": "corpus/source/apps/docs/src/content/docs/docs/cli/reference/star.mdx",
  "sourceSha256": "b4b5593af5e668115016d5ac02c8ff5fb71f6bfee298ae46fb9109ed6db98369",
  "metadata": {
    "title": "🔹 star",
    "description": "⭐ Star a Capgo GitHub repository to support the project.",
    "sidebar_label": "star",
    "sidebar": {
      "order": 2
    }
  },
  "blocks": [
    {
      "type": "paragraph",
      "location": {
        "line": 2,
        "column": 1
      },
      "blocks": [
        {
          "type": "text",
          "location": {
            "line": 2,
            "column": 1
          },
          "text": "⭐ Star a Capgo GitHub repository to support the project."
        }
      ]
    },
    {
      "type": "code",
      "location": {
        "line": 4,
        "column": 1
      },
      "lang": "bash",
      "meta": null,
      "text": "npx @capgo/cli@latest star"
    },
    {
      "type": "paragraph",
      "location": {
        "line": 8,
        "column": 1
      },
      "blocks": [
        {
          "type": "text",
          "location": {
            "line": 8,
            "column": 1
          },
          "text": "If you do not pass a repository name, this defaults to capacitor-updater in the Cap-go org."
        }
      ]
    },
    {
      "type": "heading",
      "location": {
        "line": 10,
        "column": 1
      },
      "depth": 2,
      "blocks": [
        {
          "type": "text",
          "location": {
            "line": 10,
            "column": 4
          },
          "text": "Keep going from star"
        }
      ]
    },
    {
      "type": "paragraph",
      "location": {
        "line": 12,
        "column": 1
      },
      "blocks": [
        {
          "type": "text",
          "location": {
            "line": 12,
            "column": 1
          },
          "text": "If you are using "
        },
        {
          "type": "strong",
          "location": {
            "line": 12,
            "column": 18
          },
          "blocks": [
            {
              "type": "text",
              "location": {
                "line": 12,
                "column": 20
              },
              "text": "star"
            }
          ]
        },
        {
          "type": "text",
          "location": {
            "line": 12,
            "column": 26
          },
          "text": " to plan dashboard and API operations, connect it with "
        },
        {
          "type": "link",
          "location": {
            "line": 12,
            "column": 81
          },
          "url": "/docs/public-api/",
          "title": null,
          "blocks": [
            {
              "type": "text",
              "location": {
                "line": 12,
                "column": 82
              },
              "text": "API Overview"
            }
          ]
        },
        {
          "type": "text",
          "location": {
            "line": 12,
            "column": 114
          },
          "text": " for the implementation detail in API Overview, "
        },
        {
          "type": "link",
          "location": {
            "line": 12,
            "column": 162
          },
          "url": "/docs/webapp/",
          "title": null,
          "blocks": [
            {
              "type": "text",
              "location": {
                "line": 12,
                "column": 163
              },
              "text": "Introduction"
            }
          ]
        },
        {
          "type": "text",
          "location": {
            "line": 12,
            "column": 191
          },
          "text": " for the implementation detail in Introduction, "
        },
        {
          "type": "link",
          "location": {
            "line": 12,
            "column": 239
          },
          "url": "/docs/public-api/api-keys/",
          "title": null,
          "blocks": [
            {
              "type": "text",
              "location": {
                "line": 12,
                "column": 240
              },
              "text": "API Keys"
            }
          ]
        },
        {
          "type": "text",
          "location": {
            "line": 12,
            "column": 277
          },
          "text": " for the implementation detail in API Keys, "
        },
        {
          "type": "link",
          "location": {
            "line": 12,
            "column": 321
          },
          "url": "/docs/public-api/devices/",
          "title": null,
          "blocks": [
            {
              "type": "text",
              "location": {
                "line": 12,
                "column": 322
              },
              "text": "Devices"
            }
          ]
        },
        {
          "type": "text",
          "location": {
            "line": 12,
            "column": 357
          },
          "text": " for the implementation detail in Devices, and "
        },
        {
          "type": "link",
          "location": {
            "line": 12,
            "column": 404
          },
          "url": "/docs/public-api/bundles/",
          "title": null,
          "blocks": [
            {
              "type": "text",
              "location": {
                "line": 12,
                "column": 405
              },
              "text": "Bundles"
            }
          ]
        },
        {
          "type": "text",
          "location": {
            "line": 12,
            "column": 440
          },
          "text": " for the implementation detail in Bundles."
        }
      ]
    }
  ]
}
