{
  "version": 1,
  "route": "/docs/plugins/social-login/integrations/github/",
  "source": "corpus/source/apps/docs/src/content/docs/docs/plugins/social-login/integrations/github.mdx",
  "sourceSha256": "9dc4ba05e0878ed030a9ac88187f1b1f8045dc5603fe14b855f273e07b1f74f0",
  "metadata": {
    "title": "GitHub",
    "description": "Integrate GitHub OAuth with @capgo/capacitor-social-login using the built-in generic OAuth2 provider.",
    "sidebar": {
      "order": 5
    }
  },
  "blocks": [
    {
      "type": "heading",
      "location": {
        "line": 2,
        "column": 1
      },
      "depth": 2,
      "blocks": [
        {
          "type": "text",
          "location": {
            "line": 2,
            "column": 4
          },
          "text": "Overview"
        }
      ]
    },
    {
      "type": "paragraph",
      "location": {
        "line": 4,
        "column": 1
      },
      "blocks": [
        {
          "type": "text",
          "location": {
            "line": 4,
            "column": 1
          },
          "text": "GitHub is supported through the built-in generic "
        },
        {
          "type": "inlineCode",
          "location": {
            "line": 4,
            "column": 50
          },
          "text": "oauth2"
        },
        {
          "type": "text",
          "location": {
            "line": 4,
            "column": 58
          },
          "text": " provider."
        }
      ]
    },
    {
      "type": "heading",
      "location": {
        "line": 6,
        "column": 1
      },
      "depth": 2,
      "blocks": [
        {
          "type": "text",
          "location": {
            "line": 6,
            "column": 4
          },
          "text": "Example"
        }
      ]
    },
    {
      "type": "code",
      "location": {
        "line": 8,
        "column": 1
      },
      "lang": "typescript",
      "meta": null,
      "text": "import { SocialLogin } from '@capgo/capacitor-social-login';\n\nawait SocialLogin.initialize({\n  oauth2: {\n    github: {\n      appId: 'your-github-client-id',\n      authorizationBaseUrl: 'https://github.com/login/oauth/authorize',\n      accessTokenEndpoint: 'https://github.com/login/oauth/access_token',\n      redirectUrl: 'myapp://oauth/github',\n      scope: 'read:user user:email',\n      pkceEnabled: true,\n      resourceUrl: 'https://api.github.com/user',\n    },\n  },\n});\n\nconst result = await SocialLogin.login({\n  provider: 'oauth2',\n  options: {\n    providerId: 'github',\n  },\n});\n\nconsole.log(result.result.accessToken?.token);\nconsole.log(result.result.resourceData);"
    },
    {
      "type": "heading",
      "location": {
        "line": 36,
        "column": 1
      },
      "depth": 2,
      "blocks": [
        {
          "type": "text",
          "location": {
            "line": 36,
            "column": 4
          },
          "text": "Related docs"
        }
      ]
    },
    {
      "type": "list",
      "location": {
        "line": 38,
        "column": 1
      },
      "ordered": false,
      "start": null,
      "spread": false,
      "blocks": [
        {
          "type": "listItem",
          "location": {
            "line": 38,
            "column": 1
          },
          "spread": false,
          "checked": null,
          "blocks": [
            {
              "type": "paragraph",
              "location": {
                "line": 38,
                "column": 3
              },
              "blocks": [
                {
                  "type": "link",
                  "location": {
                    "line": 38,
                    "column": 3
                  },
                  "url": "/docs/plugins/social-login/oauth2/",
                  "title": null,
                  "blocks": [
                    {
                      "type": "text",
                      "location": {
                        "line": 38,
                        "column": 4
                      },
                      "text": "OAuth2 and OIDC providers"
                    }
                  ]
                }
              ]
            }
          ]
        },
        {
          "type": "listItem",
          "location": {
            "line": 39,
            "column": 1
          },
          "spread": false,
          "checked": null,
          "blocks": [
            {
              "type": "paragraph",
              "location": {
                "line": 39,
                "column": 3
              },
              "blocks": [
                {
                  "type": "link",
                  "location": {
                    "line": 39,
                    "column": 3
                  },
                  "url": "/docs/plugins/social-login/better-auth/",
                  "title": null,
                  "blocks": [
                    {
                      "type": "text",
                      "location": {
                        "line": 39,
                        "column": 4
                      },
                      "text": "Better Auth integration"
                    }
                  ]
                }
              ]
            }
          ]
        }
      ]
    },
    {
      "type": "heading",
      "location": {
        "line": 41,
        "column": 1
      },
      "depth": 2,
      "blocks": [
        {
          "type": "text",
          "location": {
            "line": 41,
            "column": 4
          },
          "text": "Keep going from GitHub"
        }
      ]
    },
    {
      "type": "paragraph",
      "location": {
        "line": 43,
        "column": 1
      },
      "blocks": [
        {
          "type": "text",
          "location": {
            "line": 43,
            "column": 1
          },
          "text": "If you are using "
        },
        {
          "type": "strong",
          "location": {
            "line": 43,
            "column": 18
          },
          "blocks": [
            {
              "type": "text",
              "location": {
                "line": 43,
                "column": 20
              },
              "text": "GitHub"
            }
          ]
        },
        {
          "type": "text",
          "location": {
            "line": 43,
            "column": 28
          },
          "text": " to plan authentication and account flows, connect it with "
        },
        {
          "type": "link",
          "location": {
            "line": 43,
            "column": 87
          },
          "url": "/plugins/capacitor-social-login/",
          "title": null,
          "blocks": [
            {
              "type": "text",
              "location": {
                "line": 43,
                "column": 88
              },
              "text": "Using @capgo/capacitor-social-login"
            }
          ]
        },
        {
          "type": "text",
          "location": {
            "line": 43,
            "column": 158
          },
          "text": " for the native capability in Using @capgo/capacitor-social-login, "
        },
        {
          "type": "link",
          "location": {
            "line": 43,
            "column": 225
          },
          "url": "/docs/plugins/social-login/",
          "title": null,
          "blocks": [
            {
              "type": "text",
              "location": {
                "line": 43,
                "column": 226
              },
              "text": "@capgo/capacitor-social-login"
            }
          ]
        },
        {
          "type": "text",
          "location": {
            "line": 43,
            "column": 285
          },
          "text": " for the implementation detail in @capgo/capacitor-social-login, "
        },
        {
          "type": "link",
          "location": {
            "line": 43,
            "column": 350
          },
          "url": "/docs/plugins/passkey/",
          "title": null,
          "blocks": [
            {
              "type": "text",
              "location": {
                "line": 43,
                "column": 351
              },
              "text": "@capgo/capacitor-passkey"
            }
          ]
        },
        {
          "type": "text",
          "location": {
            "line": 43,
            "column": 400
          },
          "text": " for the implementation detail in @capgo/capacitor-passkey, "
        },
        {
          "type": "link",
          "location": {
            "line": 43,
            "column": 460
          },
          "url": "/docs/plugins/native-biometric/",
          "title": null,
          "blocks": [
            {
              "type": "text",
              "location": {
                "line": 43,
                "column": 461
              },
              "text": "@capgo/capacitor-native-biometric"
            }
          ]
        },
        {
          "type": "text",
          "location": {
            "line": 43,
            "column": 528
          },
          "text": " for the implementation detail in @capgo/capacitor-native-biometric, and "
        },
        {
          "type": "link",
          "location": {
            "line": 43,
            "column": 601
          },
          "url": "/docs/webapp/mfa/",
          "title": null,
          "blocks": [
            {
              "type": "text",
              "location": {
                "line": 43,
                "column": 602
              },
              "text": "Two-factor authentication"
            }
          ]
        },
        {
          "type": "text",
          "location": {
            "line": 43,
            "column": 647
          },
          "text": " for the implementation detail in Two-factor authentication."
        }
      ]
    }
  ]
}
